{
  "name": "Package Host Reference",
  "version": "1.1.0",
  "description": "Synthetic executable package proving native Mosaic surfaces and governed Package behavior.",
  "homepage": "https://github.com/lockidynamics/mosaic-integrations/tree/main/packages/package-host-reference",
  "logo": "logo.svg",
  "mosaicVersion": "0.0.1",
  "slug": "reference-package",
  "category": "workflow"
}
